{
  "$schema": "../schema.json",
  "name": "corporate",
  "version": 1,
  "default": false,
  "source": { "type": "built-in" },
  "confidence": "high",
  "palette": {
    "primary":   { "fillColor": "#e3f2fd", "strokeColor": "#1565c0" },
    "success":   { "fillColor": "#e8f5e9", "strokeColor": "#2e7d32" },
    "warning":   { "fillColor": "#fff9c4", "strokeColor": "#f57c00" },
    "accent":    { "fillColor": "#fff3e0", "strokeColor": "#e65100" },
    "danger":    { "fillColor": "#ffebee", "strokeColor": "#c62828" },
    "neutral":   { "fillColor": "#eceff1", "strokeColor": "#455a64" },
    "secondary": { "fillColor": "#f3e5f5", "strokeColor": "#6a1b9a" }
  },
  "roles": {
    "service":  "primary",
    "database": "success",
    "queue":    "warning",
    "gateway":  "accent",
    "error":    "danger",
    "external": "neutral",
    "security": "secondary"
  },
  "shapes": {
    "service":   "rounded=0",
    "database":  "shape=cylinder3",
    "queue":     "rounded=0",
    "decision":  "rhombus",
    "external":  "rounded=0;dashed=1",
    "container": "swimlane;startSize=30"
  },
  "font": {
    "fontFamily": "Arial",
    "fontSize": 11,
    "titleFontSize": 13,
    "titleBold": true
  },
  "edges": {
    "style": "edgeStyle=orthogonalEdgeStyle;rounded=0;orthogonalLoop=1;jettySize=auto;html=1",
    "arrow": "endArrow=classic;endFill=1",
    "dashedFor": ["optional", "async"]
  },
  "extras": {
    "sketch": false,
    "globalStrokeWidth": 1
  }
}

